{
  "meta": {
    "eyebrow": "이우백두 21기 · 백두대간 종주",
    "title": "21기 종산제 · 종산식 준비 로드맵 (가안)",
    "start": "2026-10",
    "end": "2026-12",
    "asOf": "2026-10-12",
    "timelineTitle": "준비 타임라인",
    "detailTitle": "세부 준비 계획",
    "remarkTitle": "비고 (참고 자료 등)",
    "todayLabel": "오늘"
  },
  "milestones": [
    { "label": "종산제 (가안)", "date": "2026-12-12", "color": "#d97706" },
    { "label": "종산식 (가안)", "date": "2026-12-19", "color": "#dc2626" }
  ],
  "teams": [
    { "key": "PLAN", "name": "기획 · 섭외", "color": "#5b61d6",
      "remarks": [
        "종산제 12/12 · 종산식 12/19 은 예상 일정 — 확정 전까지 모든 기간은 역산 추정치",
        "기준: 40차 산행 완료 / 41차 예정 (2026-10-12)",
        "원본 체크리스트: 종산식 준비 시트 '계획' 탭 (17기 사례)"
      ] },
    { "key": "PROG", "name": "프로그램 · 진행", "color": "#0ea5a4",
      "remarks": ["16기 진행 사례 참고 (준비 시트 '16기' 탭: 종산보고 · 축문 · 사회 대본)"] },
    { "key": "ADMIN", "name": "총무 · 보급 · 식사", "color": "#2f855a", "remarks": [] },
    { "key": "MEDIA", "name": "영상", "color": "#8b5cf6", "remarks": [] },
    { "key": "AWARD", "name": "기념품 · 증서", "color": "#db2777",
      "remarks": [
        "16기: 카드형 증서(표지·속지 공통, 오른쪽 면만 완주/종주/참가별 문구), 스냅스 제작 https://m.snaps.com/",
        "16기 기념품: 시그널 주문제작 (문구는 받는 분 희망 문구)",
        "14기: 완주·종주자는 증서+액자, 참가자는 참가증서만 / 종주 20회 이상, 참가 5회 이상 기준",
        "13기 상장 양식 · 문구, 학교 홈페이지 자료: https://www.2woo.net/cafe/board/8127",
        "12기 자료: https://www.2woo.net/cafe/board/7932 · 11기 자료: https://www.2woo.net/cafe/board/7640"
      ] }
  ],
  "tasks": [
    {
      "id": "pl1", "team": "PLAN", "name": "섭외 · 일정 확인",
      "subs": [
        { "id": "pl1a", "name": "종산식 시간 확정", "owner": "기획", "start": "2026-10-19", "end": "2026-10-31", "status": "plan",
          "notes": ["17기 사례: 오후 2시 시작, 1시간 30분~2시간 진행 후 식사 장소로 이동"] },
        { "id": "pl1b", "name": "교장선생님 일정 확인 (축사 · 시상)", "owner": "기획", "start": "2026-10-19", "end": "2026-11-13", "status": "plan",
          "notes": ["종산식 전 주(12/7~12/11)에 최종 알림 필요"] },
        { "id": "pl1c", "name": "선배 기수에 종산제 준비 요청", "owner": "기획", "start": "2026-10-19", "end": "2026-11-14", "status": "plan",
          "notes": ["선배 기수 산행대장께 최종 확인 (참가 인원 포함)"] },
        { "id": "pl1d", "name": "기수별 참가자 수 확인", "owner": "기획", "start": "2026-11-02", "end": "2026-12-04", "status": "plan",
          "notes": ["신학지 의자 수 · 식사 장소 규모 산정 기준", "17기 사례: 총 100명 내외"] },
        { "id": "pl1e", "name": "종산 · 참가 대상자 확정", "owner": "기획", "start": "2026-11-16", "end": "2026-12-05", "status": "plan",
          "notes": ["완주/종주/참가 기준 확정 후 마지막 정기산행 참가 신청까지 반영"] },
        { "id": "pl1f", "name": "후배 기수에 신학지 꾸미기 요청", "owner": "기획", "start": "2026-11-02", "end": "2026-12-11", "status": "plan",
          "notes": ["작업 시간 포함 최종 확인 필요"] },
        { "id": "pl1g", "name": "선배 기수에 종산 축하 영상 요청", "owner": "기획", "start": "2026-11-02", "end": "2026-12-04", "status": "plan",
          "notes": ["받은 영상은 영상대장이 하나로 합침 (md1b)"] },
        { "id": "pl1h", "name": "초대장 작성 (종산제 · 종산식)", "owner": "", "start": "2026-11-09", "end": "2026-11-27", "status": "plan",
          "notes": ["13기 초대장 참고"] }
      ]
    },
    {
      "id": "pr1", "team": "PROG", "name": "종산제 (12/12)",
      "subs": [
        { "id": "pr1a", "name": "종산제 축문 준비", "owner": "기획", "start": "2026-11-30", "end": "2026-12-11", "status": "plan",
          "notes": ["16기 축문(가로/세로) 양식 참고", "라이터 지참자 지정 필요"] },
        { "id": "pr1b", "name": "종산보고 작성", "owner": "기획", "start": "2026-11-23", "end": "2026-12-11", "status": "plan",
          "notes": ["16기 종산보고 참고"] }
      ]
    },
    {
      "id": "pr2", "team": "PROG", "name": "종산식 프로그램 (12/19)",
      "subs": [
        { "id": "pr2a", "name": "식순 · 사회자 멘트 기획", "owner": "체조, 수색, 기획", "start": "2026-11-16", "end": "2026-12-11", "status": "plan",
          "notes": ["진행 순서(시간 포함) · 사회자 멘트", "조명/음향 담당 섭외 논의 필요", "완주/종주/참가 증서 수여 순서 정리 — 무대에서 증서 전달 보조 2인 배치"] },
        { "id": "pr2b", "name": "당일 준비물 · 사전 점검", "owner": "기획", "start": "2026-12-14", "end": "2026-12-19", "status": "plan",
          "notes": ["신학지 열쇠 · 마이크 · 노트북", "후배 기수 준비 · 교장선생님 최종 연락 · 축하공연 악기 배치 · 음향/조명/노트북 연결 확인"] },
        { "id": "pr2c", "name": "종산식 진행", "owner": "체조, 수색", "start": "2026-12-19", "end": "2026-12-19", "status": "plan",
          "notes": ["16기 진행 사례 참고"] }
      ]
    },
    {
      "id": "ad1", "team": "ADMIN", "name": "장소 · 식사",
      "subs": [
        { "id": "ad1a", "name": "신학지 예약", "owner": "총무", "start": "2026-10-19", "end": "2026-11-06", "status": "plan",
          "notes": ["학교 오르막길 주차장 이용 요청", "오전 개방 시간 요청", "마이크 2개 준비"] },
        { "id": "ad1b", "name": "저녁 식사 장소 예약", "owner": "식사, 총무", "start": "2026-10-19", "end": "2026-11-13", "status": "plan",
          "notes": ["후보: 진지방 / 함관령 — 100명이 한곳에 앉을 수 있는지 확인", "주류·음료 포함 여부, 식사 시간 연장(1시간 30분) 가능 여부 · 비용 확인"] },
        { "id": "ad1c", "name": "종산식 · 잔치 주류/음료 수량 산정 · 구매", "owner": "총무", "start": "2026-11-30", "end": "2026-12-18", "status": "plan",
          "notes": ["17기 사례: 웰치스캔 48 · 식혜캔 48 · 맥주캔 48 · 맥주PET 6 · 소주PET 20", "참가자 수 확정(pl1d) 후 조정"] }
      ]
    },
    {
      "id": "ad2", "team": "ADMIN", "name": "종산제 보급",
      "subs": [
        { "id": "ad2a", "name": "제수 준비 (과일 · 막걸리)", "owner": "총무, 보급", "start": "2026-12-07", "end": "2026-12-12", "status": "plan",
          "notes": ["17기 사례: 사과 1 · 배 1 · 막걸리 3"] }
      ]
    },
    {
      "id": "md1", "team": "MEDIA", "name": "영상",
      "subs": [
        { "id": "md1a", "name": "21기 종주 영상 제작 (5분 내외)", "owner": "영상", "start": "2026-11-09", "end": "2026-12-16", "status": "plan",
          "notes": ["단체 사진 · 주요 사진 위주", "마지막 정기산행 사진까지 반영"] },
        { "id": "md1b", "name": "선배 기수 축하 영상 편집 (하나로 합치기)", "owner": "영상", "start": "2026-12-01", "end": "2026-12-16", "status": "plan", "notes": [] }
      ]
    },
    {
      "id": "aw1", "team": "AWARD", "name": "완주패 · 감사패 · 기념품",
      "subs": [
        { "id": "aw1a", "name": "제작 기획 (대상 · 수량 · 품목)", "owner": "의료, 박보급, 교육, 안전", "start": "2026-10-19", "end": "2026-11-13", "status": "plan",
          "notes": ["완주패: 21기 완주자 + 특임/선두/산행대장 등 대상 확정", "감사패: 숲선생님", "기념품: 종산식 참가자용 (교장선생님 별도), 가족당 수량 · 배포 시점(식 전/후) 결정 필요"] },
        { "id": "aw1b", "name": "제작 발주 · 수령", "owner": "의료, 박보급, 교육, 안전", "start": "2026-11-16", "end": "2026-12-11", "status": "plan",
          "notes": ["주문제작 소요 기간 감안해 11월 중 발주"] }
      ]
    },
    {
      "id": "aw2", "team": "AWARD", "name": "참가 · 종주 · 완주 증서",
      "subs": [
        { "id": "aw2a", "name": "증서 형식 의견 수렴 · 투표", "owner": "곽보급, 배너, 후미, 선두", "start": "2026-10-26", "end": "2026-11-20", "status": "plan",
          "notes": ["증서에 참가 횟수 · 산행 거리 기록 검토"] },
        { "id": "aw2b", "name": "증서 문구 작성 · 제작", "owner": "곽보급, 배너, 후미, 선두", "start": "2026-11-23", "end": "2026-12-16", "status": "plan",
          "notes": ["대상자 확정(pl1e) 후 문구 확정", "일부는 개인 맞춤 문구 — 잘 아는 분이 나눠 작성"] }
      ]
    }
  ]
}
